[
  {
    "id": "1",
    "name": "Hazrat Imam Ali (a.s)",
    "nickname": "Abu Turab / Asadullah",
    "gender_id": 1,
    "father_id": "2",
    "mother_id": "3",
    "parent_id": "2",
    "birth_order": 1,
    "generation": 1,
    "yob": 601,
    "yod": 661,
    "text_color": "#ffffff",
    "bg_color": "#166534",
    "profile_url": "https://shajjra.com/users/1"
  },
  {
    "id": "2",
    "name": "Hazrat Abu Talib (a.s)",
    "nickname": "Imran",
    "gender_id": 1,
    "father_id": "4",
    "mother_id": "5",
    "parent_id": "4",
    "birth_order": 1,
    "generation": 2,
    "yob": 535,
    "yod": 619,
    "text_color": "#ffffff",
    "bg_color": "#1e3a8a",
    "profile_url": "https://shajjra.com/users/2"
  },
  {
    "id": "3",
    "name": "Fatima bint Asad (r.a)",
    "nickname": "Umm Ali",
    "gender_id": 2,
    "father_id": null,
    "mother_id": null,
    "parent_id": null,
    "birth_order": 1,
    "generation": 2,
    "yob": 555,
    "yod": 626,
    "text_color": "#ffffff",
    "bg_color": "#831843",
    "profile_url": "https://shajjra.com/users/3"
  },
  {
    "id": "4",
    "name": "Abdul Muttalib",
    "nickname": "Shaybah al-Hamd",
    "gender_id": 1,
    "father_id": "6",
    "mother_id": "7",
    "parent_id": "6",
    "birth_order": 1,
    "generation": 3,
    "yob": 497,
    "yod": 578,
    "text_color": "#ffffff",
    "bg_color": "#1e3a8a",
    "profile_url": "https://shajjra.com/users/4"
  },
  {
    "id": "5",
    "name": "Fatimah bint Amr",
    "nickname": null,
    "gender_id": 2,
    "father_id": null,
    "mother_id": null,
    "parent_id": null,
    "birth_order": 1,
    "generation": 3,
    "yob": 510,
    "yod": 576,
    "text_color": "#ffffff",
    "bg_color": "#831843",
    "profile_url": "https://shajjra.com/users/5"
  },
  {
    "id": "6",
    "name": "Hashim ibn Abd Manaf",
    "nickname": "Amr al-Ula",
    "gender_id": 1,
    "father_id": "8",
    "mother_id": null,
    "parent_id": "8",
    "birth_order": 1,
    "generation": 4,
    "yob": 464,
    "yod": 497,
    "text_color": "#ffffff",
    "bg_color": "#0f172a",
    "profile_url": "https://shajjra.com/users/6"
  },
  {
    "id": "7",
    "name": "Salma bint Amr",
    "nickname": "Of Banu Najjar",
    "gender_id": 2,
    "father_id": null,
    "mother_id": null,
    "parent_id": null,
    "birth_order": 1,
    "generation": 4,
    "yob": 470,
    "yod": 530,
    "text_color": "#ffffff",
    "bg_color": "#831843",
    "profile_url": "https://shajjra.com/users/7"
  },
  {
    "id": "8",
    "name": "Abd Manaf ibn Qusai",
    "nickname": "Al-Mughirah",
    "gender_id": 1,
    "father_id": "9",
    "mother_id": null,
    "parent_id": "9",
    "birth_order": 1,
    "generation": 5,
    "yob": 430,
    "yod": 480,
    "text_color": "#ffffff",
    "bg_color": "#0f172a",
    "profile_url": "https://shajjra.com/users/8"
  },
  {
    "id": "9",
    "name": "Qusai ibn Kilab",
    "nickname": "Zayd / Unifier of Quraysh",
    "gender_id": 1,
    "father_id": "10",
    "mother_id": null,
    "parent_id": "10",
    "birth_order": 1,
    "generation": 6,
    "yob": 400,
    "yod": 480,
    "text_color": "#ffffff",
    "bg_color": "#0f172a",
    "profile_url": "https://shajjra.com/users/9"
  },
  {
    "id": "10",
    "name": "Kilab ibn Murrah",
    "nickname": "Hakim",
    "gender_id": 1,
    "father_id": null,
    "mother_id": null,
    "parent_id": null,
    "birth_order": 1,
    "generation": 7,
    "yob": 373,
    "yod": 435,
    "text_color": "#ffffff",
    "bg_color": "#0f172a",
    "profile_url": "https://shajjra.com/users/10"
  }
]
